{
  "$schema": "https://json-schema.org/draft/2020-12/schema",
  "$id": "https://weaver-spec.dev/contracts/v0/handle.schema.json",
  "title": "Handle",
  "description": "An opaque, access-controlled reference to a raw artifact produced by a tool execution. The actual content is stored in the HandleStore and is not included here. Resolution requires authorization.",
  "x_weaver_stability": "stable",
  "type": "object",
  "required": ["handle_id", "capability_id", "artifact_type", "created_at"],
  "properties": {
    "handle_id": {
      "type": "string",
      "minLength": 1,
      "description": "Unique identifier for this Handle. Must not be sufficient to access the artifact without authorization."
    },
    "capability_id": {
      "type": "string",
      "minLength": 1,
      "description": "The capability that produced the artifact this Handle references."
    },
    "artifact_type": {
      "type": "string",
      "minLength": 1,
      "description": "MIME type or semantic type of the stored artifact (e.g., 'application/json', 'text/plain', 'image/png')."
    },
    "created_at": {
      "type": "string",
      "format": "date-time",
      "description": "ISO 8601 timestamp of when this Handle was created."
    },
    "expires_at": {
      "type": ["string", "null"],
      "format": "date-time",
      "description": "ISO 8601 expiry timestamp. Null if the artifact does not expire."
    },
    "access_policy": {
      "type": "string",
      "description": "Optional reference to the access policy or policy ID governing who can resolve this Handle."
    },
    "byte_size": {
      "type": ["integer", "null"],
      "minimum": 0,
      "description": "Optional size of the artifact in bytes, for capacity planning."
    },
    "metadata": {
      "type": "object",
      "description": "Optional implementation-specific metadata.",
      "additionalProperties": true
    }
  },
  "additionalProperties": true
}
