{
  "handle_id": "handle-rawresult-20260308-001",
  "capability_id": "org.myapp.search_docs",
  "artifact_type": "application/json",
  "created_at": "2026-03-08T06:00:05Z",
  "expires_at": "2026-03-09T06:00:05Z",
  "access_policy": "policy://agent-kernel/handle-default",
  "byte_size": 18432,
  "metadata": {
    "storage_backend": "handlestore-prod-us-east-1",
    "frame_id": "frame-20260308-001"
  }
}
